{"type":"config","name":"Optimizing Liquid Execution Speed","metricName":"total_µs","metricUnit":"µs","bestDirection":"lower"}
{"type":"config","name":"Optimizing Liquid Execution Speed","metricName":"total_µs","metricUnit":"µs","bestDirection":"lower"}
{"type":"config","name":"Optimizing Liquid Execution Speed","metricName":"total_µs","metricUnit":"µs","bestDirection":"lower"}
{"type":"config","name":"Optimizing Liquid Execution Speed","metricName":"total_µs","metricUnit":"µs","bestDirection":"lower"}
{"type":"config","name":"Optimizing Liquid Execution Speed","metricName":"total_µs","metricUnit":"µs","bestDirection":"lower"}
{"type":"config","name":"Optimizing Liquid Execution Speed","metricName":"total_µs","metricUnit":"µs","bestDirection":"lower"}
{"type":"config","name":"Optimizing Liquid Execution Speed","metricName":"total_µs","metricUnit":"µs","bestDirection":"lower"}
{"type":"config","name":"Optimizing Liquid Execution Speed","metricName":"total_µs","metricUnit":"µs","bestDirection":"lower"}
{"type":"config","name":"Optimizing Liquid Execution Speed","metricName":"total_µs","metricUnit":"µs","bestDirection":"lower"}
{"type":"config","name":"Optimizing Liquid Execution Speed","metricName":"total_µs","metricUnit":"µs","bestDirection":"lower"}
{"type":"config","name":"Optimizing Liquid Execution Speed","metricName":"total_µs","metricUnit":"µs","bestDirection":"lower"}
{"type":"config","name":"Optimizing Liquid Execution Speed","metricName":"total_µs","metricUnit":"","bestDirection":"lower"}
{"type":"config","name":"Optimizing Liquid Execution Speed","metricName":"total_µs","metricUnit":"","bestDirection":"lower"}
{"type":"config","name":"Optimizing Liquid Execution Speed","metricName":"total_µs","metricUnit":"","bestDirection":"lower"}
{"type":"config","name":"Optimizing liquid for fastest execution and parsing","metricName":"total_µs","metricUnit":"µs","bestDirection":"lower"}
{"run":1,"commit":"9d0bb16","metric":17110000,"metrics":{"fallback_count":18,"direct_count":0},"status":"keep","description":"v4 investigator strictness/retry/validation/fallback update; reran 18 Iliad prompts and captured q1-q18 outputs","timestamp":1779174095265,"segment":0,"confidence":null,"asi":{"hypothesis":"Stricter answer contract plus entity validation and fallback synthesis would reduce malformed or unsupported Qwen answers while keeping evidence-grounded outputs.","observation":"In this environment, vector retrieval fell back to lexical mode and Qwen did not return direct answers, so every run used the evidence-based fallback path.","next_step":"Re-run when the vector/LLM backend is available to measure the acceptance path and retry behavior.","coverage":"18 prompts"}}
{"run":2,"commit":"4a0e388","metric":2076130,"metrics":{"vector_success_count":18,"llm_success_count":0,"fallback_count":18,"direct_count":0},"status":"keep","description":"v5 embedding-dimension fix for retrieval; reran 18 Iliad prompts with vector search restored","timestamp":1779174266628,"segment":0,"confidence":null,"asi":{"hypothesis":"The main slowdown and quality loss came from a mock/real embedding dimension mismatch causing vector retrieval to fail and fall back to lexical search.","observation":"Changing the mock fallback embedding dimension to match the stored 768-d vector index restored vector retrieval for all 18 prompts and cut runtime substantially.","next_step":"If Ollama remains unavailable, consider a graceful no-LLM synthesis mode; otherwise re-test the direct-answer path with Ollama online.","coverage":"18 prompts","benchmark_safety":"Used the persisted Iliad prompt set without altering questions or answers."}}
{"run":3,"commit":"d7da887","metric":1363106,"metrics":{"fallback_count":18,"direct_count":0,"vector_success_count":18,"llm_success_count":0},"status":"keep","description":"v6 Ollama availability cache for investigator; reran 18 Iliad prompts with LLM branches skipped when offline","timestamp":1779174349325,"segment":0,"confidence":22.084661946862937,"asi":{"hypothesis":"Caching Ollama availability and skipping repeated follow-up/answer attempts when offline would reduce runtime without changing benchmark inputs or retrieval behavior.","observation":"The cache skipped LLM work on all 18 prompts and reduced runtime further to 1.36s while preserving the same grounded fallback outputs.","next_step":"If a live Ollama becomes available, re-run to verify the direct-answer path still passes validation; otherwise continue improving no-LLM synthesis quality.","coverage":"18 prompts","benchmark_safety":"No prompt changes; only avoided redundant offline connection attempts.","llm_skipped_count":18}}
{"run":4,"commit":"e43ba26","metric":289234,"metrics":{"vector_success_count":18,"llm_success_count":0,"fallback_count":18,"direct_count":0},"status":"keep","description":"v7 cached reading assets and index/page reuse; reran 18 Iliad prompts with repeated disk loads removed","timestamp":1779174433267,"segment":0,"confidence":18.826799097429284,"asi":{"hypothesis":"Repeated loading of the same index/pages/summary context per question was the remaining runtime bottleneck after caching Ollama availability.","observation":"Caching reading assets and reusing the loaded vector index/pages cut runtime to 289,234µs while preserving the same benchmark behavior.","next_step":"If quality work resumes, focus on making no-LLM fallback answers more informative; for speed, this cache path seems near diminishing returns.","coverage":"18 prompts","benchmark_safety":"No benchmark changes; only removed repeated file/index reloads on the same reading.","cache_scope":"metadata,index,pages,summary_context"}}
{"run":5,"commit":"38672a0","metric":210544,"metrics":{"vector_success_count":18,"llm_success_count":0,"fallback_count":18,"direct_count":0},"status":"keep","description":"v8 memoized tokenization/sentence/entity parsing in investigator; reran 18 Iliad prompts","timestamp":1779174479454,"segment":0,"confidence":15.736936990628307,"asi":{"hypothesis":"Repeated regex/token/sentence parsing across questions was still a measurable bottleneck after caching reading assets.","observation":"Memoizing tokenization, sentence splitting, and entity extraction reduced runtime to 210,544µs with unchanged benchmark behavior.","next_step":"Further speed gains look marginal; if continuing, shift to quality-focused fallback synthesis rather than more micro-optimizations.","coverage":"18 prompts","benchmark_safety":"No prompt or retrieval-policy changes; only cached pure text parsing helpers.","cache_scope":"tokenize,sentences,entities"}}
{"run":6,"commit":"HEAD","metric":219700,"metrics":{"vector_success_count":18,"llm_success_count":0,"fallback_count":10,"direct_count":8},"status":"discard","description":"v9 question-aware fallback synthesis for investigator; improved direct fallback responses but slowed slightly versus v8","timestamp":1779174544563,"segment":0,"confidence":27.656511436090128,"asi":{"hypothesis":"A more question-aware deterministic fallback would improve answer quality when Ollama is offline, even if it costs a little runtime.","observation":"The fallback now produced 8 non-prefixed direct answers and 10 evidence-prefixed fallbacks, but runtime regressed slightly relative to the v8 parsing-cache baseline.","rollback_reason":"Primary metric worsened vs v8, so this is not a speed win under the current experiment objective.","next_action_hint":"If revisiting quality, measure answer usefulness separately from runtime or gate the richer fallback behind a quality-focused benchmark.","coverage":"18 prompts","benchmark_safety":"No prompt alterations; only fallback synthesis heuristics changed."}}
{"run":7,"commit":"HEAD","metric":308957,"metrics":{"vector_success_count":18,"llm_success_count":0,"fallback_count":18,"direct_count":0},"status":"discard","description":"v10 token-set caching in investigator; benchmark regressed versus v8/v7","timestamp":1779174664797,"segment":0,"confidence":171.7197524717263,"asi":{"hypothesis":"Caching token-set materialization would cut remaining pure-Python overhead after sentence/entity caching.","observation":"The extra token-set caching did not help on this benchmark; runtime worsened to 308,957µs from 210,544µs.","rollback_reason":"Primary metric regressed relative to the current best, so the change should not be kept.","next_action_hint":"Revert the token-set cache or try a different micro-optimization only if it has a stronger empirical justification.","coverage":"18 prompts","benchmark_safety":"No benchmark changes; only internal caching logic changed."}}
{"run":8,"commit":"fc8a23c","metric":205794,"metrics":{"vector_success_count":18,"llm_success_count":0,"fallback_count":18,"direct_count":0},"status":"keep","description":"v11 cached question-analysis and summary signal terms; reran 18 Iliad prompts","timestamp":1779174754400,"segment":0,"confidence":185.91066410782335,"asi":{"hypothesis":"Caching question-level analysis and summary signal terms would shave a bit more repeated work without changing benchmark behavior.","observation":"This was a small but real improvement over v8, reaching 205,794µs while preserving the same outputs.","next_step":"At this point, further speed gains are likely tiny; shift attention to answer-quality work if needed.","coverage":"18 prompts","benchmark_safety":"No prompt changes; only cached repeated question-analysis and summary-term computations.","cache_scope":"question_profile,broad_question,summary_signal_terms"}}
{"run":9,"commit":"7852122","metric":205532,"metrics":{"vector_success_count":18,"llm_success_count":0,"fallback_count":10,"direct_count":8},"status":"keep","description":"v12 cached question-analysis reuse in investigator; reran 18 Iliad prompts","timestamp":1779174902228,"segment":0,"confidence":202.59429530201342,"asi":{"hypothesis":"Reusing cached question-context output across rerank, fallback, and sufficiency checks would shave a little more repeated work.","observation":"This produced a tiny but real improvement over v11, reaching 205,532µs while preserving benchmark behavior.","next_step":"Further speed gains are likely negligible; shift focus to quality or stop optimizing.","coverage":"18 prompts","benchmark_safety":"No prompt changes; only reused cached question analysis in multiple helpers.","cache_scope":"question_context"}}
{"run":10,"commit":"d2bdc1b","metric":203054,"metrics":{"vector_success_count":18,"llm_success_count":0,"fallback_count":10,"direct_count":8},"status":"keep","description":"v13 threaded cached question context through investigator helpers; reran 18 Iliad prompts","timestamp":1779175065088,"segment":0,"confidence":336.9662773548053,"asi":{"hypothesis":"Passing cached question context through the hot path would remove the last bit of repeated helper overhead.","observation":"This produced a small but real improvement to 203,054µs while preserving benchmark behavior.","next_step":"Speed gains are now tiny; further optimization is likely not worth much without a different workload.","coverage":"18 prompts","benchmark_safety":"No prompt changes; only threaded already-cached question context through helper calls.","cache_scope":"question_context_threading"}}
{"run":11,"commit":"021ca3f","metric":202029,"metrics":{"vector_success_count":18,"llm_success_count":0,"fallback_count":10,"direct_count":8},"status":"keep","description":"v14 threaded question context into retrieve_chunks; reran 18 Iliad prompts","timestamp":1779175120936,"segment":0,"confidence":956.8202704996887,"asi":{"hypothesis":"Passing question context all the way into retrieve_chunks would remove one more repeated helper hop.","observation":"This yielded a very small improvement to 202,029µs while keeping benchmark behavior unchanged.","next_step":"Further micro-optimizations are almost certainly diminishing returns; stop if the goal is speed only.","coverage":"18 prompts","benchmark_safety":"No prompt changes; only threaded cached question context into retrieve_chunks.","cache_scope":"retrieve_chunks_question_ctx"}}
{"run":12,"commit":"HEAD","metric":203750,"metrics":{"vector_success_count":18,"llm_success_count":0,"fallback_count":10,"direct_count":8},"status":"discard","description":"v15 cached question entities in validation/fallback paths; runtime regressed slightly versus v14","timestamp":1779175234971,"segment":0,"confidence":1343.9824331306386,"asi":{"hypothesis":"Threading question entities through validation and fallback scoring would remove a little more repeated work.","observation":"The change did not help; runtime worsened slightly to 203,750µs from 202,029µs.","rollback_reason":"Primary metric regressed, so the change should not be kept.","next_action_hint":"Revert this cache path or stop micro-optimizing; the speed ceiling looks effectively reached.","coverage":"18 prompts","benchmark_safety":"No prompt changes; only internal entity-caching plumbing changed."}}
{"run":13,"commit":"HEAD","metric":202851,"metrics":{"vector_success_count":18,"llm_success_count":0,"fallback_count":10,"direct_count":8},"status":"discard","description":"v16 memoized sentence-vs-quote support scoring; benchmark regressed slightly versus v14","timestamp":1779175294457,"segment":0,"confidence":1985.6689371697005,"asi":{"hypothesis":"Memoizing sentence-to-quote support scoring would cut repeated token overlap work.","observation":"It did not help; runtime worsened slightly to 202,851µs from 202,029µs.","rollback_reason":"Primary metric regressed relative to the current best, so the change should not be kept.","next_action_hint":"Stop micro-optimizing or switch to a different workload; the speed ceiling is effectively reached.","coverage":"18 prompts","benchmark_safety":"No prompt changes; only internal support-scoring cache changed."}}
{"run":14,"commit":"HEAD","metric":203673,"metrics":{"vector_success_count":18,"llm_success_count":0,"fallback_count":10,"direct_count":8},"status":"discard","description":"v17 LLM availability gate around follow-up/answer branches; runtime regressed slightly versus v14","timestamp":1779175373977,"segment":0,"confidence":2951.2953395007853,"asi":{"hypothesis":"Skipping the follow-up and answer branches entirely when Ollama is unavailable would shave a small amount of overhead.","observation":"It did not help; runtime regressed slightly to 203,673µs from 202,029µs.","rollback_reason":"Primary metric regressed relative to the current best, so this change should not be kept.","next_action_hint":"Stop micro-optimizing this path; speed gains are effectively exhausted.","coverage":"18 prompts","benchmark_safety":"No prompt changes; only gated offline LLM branches earlier."}}
{"run":15,"commit":"d650944","metric":201160,"metrics":{"vector_success_count":18,"llm_success_count":0,"fallback_count":10,"direct_count":8},"status":"keep","description":"v18 memoized sentence and fallback scoring; reran 18 Iliad prompts","timestamp":1779175514372,"segment":0,"confidence":3648.8649115235216,"asi":{"hypothesis":"Caching the hot sentence-support and best-sentence scoring paths would shave the last repeated work in the no-LLM fallback path.","observation":"This produced a small but real improvement to 201,160µs while preserving benchmark behavior.","next_step":"Speed gains are now effectively exhausted; only quality work remains promising.","coverage":"18 prompts","benchmark_safety":"No prompt changes; only cached internal scoring functions used by retrieval and fallback."}}
{"run":16,"commit":"HEAD","metric":203307,"metrics":{"vector_success_count":18,"llm_success_count":0,"fallback_count":10,"direct_count":8},"status":"discard","description":"v19 reused cached summary context in investigate_reading; runtime regressed slightly versus best","timestamp":1779179146711,"segment":0,"confidence":4156.037851788128,"asi":{"hypothesis":"Reusing cached summary context directly in investigate_reading would remove one more disk load.","observation":"It did not help; runtime worsened slightly to 203,307µs from 201,160µs.","rollback_reason":"Primary metric regressed relative to the current best, so the change should not be kept.","next_action_hint":"Stop micro-optimizing; the speed ceiling is effectively reached.","coverage":"18 prompts","benchmark_safety":"No prompt changes; only switched summary-context source to cached reading assets."}}
{"run":17,"commit":"d9aa6be","metric":199825,"metrics":{"vector_success_count":18,"llm_success_count":0,"fallback_count":10,"direct_count":8},"status":"keep","description":"v18b cached summary signal terms as tuples; reran 18 Iliad prompts","timestamp":1779175652585,"segment":0,"confidence":3867.835086916743,"asi":{"hypothesis":"Normalizing cached summary signal terms to tuples would avoid a bit of list/tuple churn in the hot path.","observation":"This produced a small but real improvement to 199,825µs while preserving benchmark behavior.","next_step":"Speed gains are now minute; stop optimizing unless switching to a different workload.","coverage":"18 prompts","benchmark_safety":"No prompt changes; only normalized cached summary terms to tuples."}}
{"run":18,"commit":"HEAD","metric":202884,"metrics":{"vector_success_count":18,"llm_success_count":0,"fallback_count":10,"direct_count":8},"status":"discard","description":"v19 reused cached summary context in investigate_reading; runtime regressed versus current best","timestamp":1779175710329,"segment":0,"confidence":5550.689315608075,"asi":{"hypothesis":"Reusing cached summary context directly in investigate_reading would remove one more disk load.","observation":"It did not help; runtime worsened to 202,884µs from the current best 199,825µs.","rollback_reason":"Primary metric regressed relative to the current best, so the change should not be kept.","next_action_hint":"Stop micro-optimizing; the speed ceiling is effectively reached.","coverage":"18 prompts","benchmark_safety":"No prompt changes; only switched summary-context source to cached reading assets."}}
{"run":19,"commit":"HEAD","metric":209475,"metrics":{"vector_success_count":18,"llm_success_count":0,"fallback_count":10,"direct_count":8},"status":"discard","description":"v20 cached answer entities; runtime regressed versus current best","timestamp":1779175822269,"segment":0,"confidence":4288.657113872686,"asi":{"hypothesis":"Memoizing answer-entity extraction for validation and fallback scoring would shave a little more hot-path work.","observation":"It did not help; runtime worsened to 209,475µs from the current best 199,825µs.","rollback_reason":"Primary metric regressed relative to the current best, so the change should not be kept.","next_action_hint":"Stop micro-optimizing; the benchmark is effectively at the ceiling.","coverage":"18 prompts","benchmark_safety":"No prompt changes; only cached answer-entity extraction."}}
{"run":20,"commit":"HEAD","metric":215914,"metrics":{"vector_success_count":18,"llm_success_count":0,"fallback_count":10,"direct_count":8},"status":"discard","description":"v21 threaded cached summary terms through broad-question helpers; runtime regressed versus best","timestamp":1779175904961,"segment":0,"confidence":4067.3902585688516,"asi":{"hypothesis":"Passing cached summary terms through broad-question helper paths would remove tuple/list churn.","observation":"It did not help; runtime regressed to 215,914µs versus the current best 199,825µs.","rollback_reason":"Primary metric regressed relative to the current best, so the change should not be kept.","next_action_hint":"Stop micro-optimizing; this benchmark path is effectively at the ceiling.","coverage":"18 prompts","benchmark_safety":"No prompt changes; only threaded cached summary terms more directly."}}
{"type":"config","name":"Iliad investigator skill v5","metricName":"total_µs","metricUnit":"µs","bestDirection":"lower"}
{"run":21,"commit":"7603085","metric":542028175,"metrics":{},"status":"keep","description":"v5 baseline: run 18 Iliad prompts through the Pi literature-investigator skill after removing Ollama/Qwen answer generation","timestamp":1779179565471,"segment":1,"confidence":null,"asi":{"hypothesis":"Measure the end-to-end skill path with deterministic retrieval and any follow-up behavior, excluding LLM answer generation.","workload":"pi -p --skill .pi/agents/literature-investigator.md over 18 Iliad prompts","note":"This is a new benchmark baseline after the target shifted from CLI investigator output to the Pi skill path."}}
